{
  "description": "retryable writes handshake failures",
  "schemaVersion": "1.3",
  "runOnRequirements": [
    {
      "minServerVersion": "4.2",
      "topologies": [
        "replicaset",
        "sharded",
        "load-balanced"
      ],
      "auth": true
    }
  ],
  "createEntities": [
    {
      "client": {
        "id": "client0",
        "useMultipleMongoses": false,
        "observeEvents": [
          "commandStartedEvent",
          "connectionCheckOutStartedEvent"
        ],
        "uriOptions": {
          "retryReads": true,
          "retryWrites": true,
          "maxPoolSize": 5
        }
      }
    },
    {
      "database": {
        "id": "database0",
        "client": "client0",
        "databaseName": "retryable-handshake-tests"
      }
    },
    {
      "collection": {
        "id": "collection0",
        "database": "database0",
        "collectionName": "coll"
      }
    }
  ],
  "initialData": [
    {
      "collectionName": "coll",
      "databaseName": "retryable-handshake-tests",
      "documents": [
        {
          "_id": 1,
          "x": 11
        }
      ]
    }
  ],
  "tests": [
    {
      "description": "InsertOne succeeds after retryable handshake error",
      "operations": [
        {
          "name": "failPoint",
          "object": "testRunner",
          "arguments": {
            "client": "client0",
            "failPoint": {
              "configureFailPoint": "failCommand",
              "mode": {
                "times": 1
              },
              "data": {
                "failCommands": [
                  "saslContinue"
                ],
                "closeConnection": true
              }
            }
          }
        },
        {
          "name": "insertOne",
          "object": "collection0",
          "arguments": {
            "document": {
              "_id": 2,
              "x": 22
            }
          }
        }
      ],
      "expectEvents": [
        {
          "client": "client0",
          "eventType": "cmap",
          "events": [
            {
              "connectionCheckOutStartedEvent": {}
            },
            {
              "connectionCheckOutStartedEvent": {}
            }
          ]
        },
        {
          "client": "client0",
          "events": [
            {
              "commandStartedEvent": {
                "command": {
                  "insert": "coll",
                  "documents": [
                    {
                      "_id": 2,
                      "x": 22
                    }
                  ]
                },
                "commandName": "insert",
                "databaseName": "retryable-handshake-tests"
              }
            }
          ]
        }
      ],
      "outcome": [
        {
          "collectionName": "coll",
          "databaseName": "retryable-handshake-tests",
          "documents": [
            {
              "_id": 1,
              "x": 11
            },
            {
              "_id": 2,
              "x": 22
            }
          ]
        }
      ]
    }
  ]
}
